{
  "raw_text": "شركة أصول إيلاف للتشغيل و الصيانة شركة شخص واحد\nذات مسئولية محدودة\nالرياض - المملكة العربية السعودية\nبالريال السعودي\nقائمة المركز المالي حتى ٣١ / ١٢ / ٢٠٢٥م\nالاصول\nالاصول غير المتداولة\nممتلكات والات ومعدات ( بالصافي )\nمشاريع تحت التنفيذ\nمجموع الأصول غير المتداولة\nالاصول المتداولة :\nنقد لدى الصندوق و البنوك\nالعملاء\nمصروفات مدفوعة مقدما\nأرصدة مدينة أخرى\nمخزون\nمجموع الاصول المتداولة\nمجموع الاصول\nحقوق الملكية والخصوم :\nحقوق الملكية\nرأس المال\nإحتياطي نظامي\nارباح مبقاه\nمجموع حقوق الملكية\nالخصوم غير المتداولة :\nمخصص مكافأة نهاية الخدمة\nأطراف ذات علاقة - دائنة\nمجموع الخصوم غير المتداولة\nالخصوم المتداولة :\nالدائنون التجاريون\nأرصدة دائنة أخرى\nمخصص الزكاة الشرعية وضريبة الدخل\nمجموع الخصوم المتداولة\nمجموع الخصوم\nمجموع حقوق الملكية والخصوم\n- ٥ -\nالمجموعة السعودية للمحاسبة والمراجعة - ص.ب ١٦٩٩٤ الرمز البريدي ١١٤٧٤ هاتف ٤٧٧٧٧٠٦ / ٢٠٦٢١٢٨ - فاكس : ٤٧٧٧٦٤٣ ٠١١\nP.O.Box 16994 Riyadh 11474 Tel.: 011 4777706 / 2062128 - Fax : 011 4777643\n\nشركة أصول إيلاف للتشغيل و الصيانة شركة شخص واحد\nذات مسئولية محدودة\nالرياض - المملكة العربية السعودية\nبالريال السعودي\nقائمة الربح أو(الخسارة) و الدخل الشامل الاخر\nعن الفترة المالية حتى ٣١ ديسمبر ٢٠٢٥م\nالإيرادات\n(-) تكلفة الايرادات\nإجمالي ربح النشاط\n(-) مصاريف إدارية وعمومية\nصافي الربح قبل الزكاة\n(-) الزكاة الشرعية وضريبة الدخل\nصافي الربح الفترة بعد الزكاة وضريبة الدخل\nإجمالي الربح والدخل الشامل بالصافي\n- ٦ -\nالمجموعة السعودية للمحاسبة والمراجعة - ص.ب ١٦٩٩٤ الرمز البريدي ١١٤٧٤ هاتف ٤٧٧٧٧٠٦ / ٢٠٦٢١٢٨ - فاكس : ٤٧٧٧٦٤٣ ٠١١\nP.O.Box 16994 Riyadh 11474 Tel.: 011 4777706 / 2062128 - Fax : 011 4777643\n\nشركة أصول إيلاف للتشغيل و الصيانة شركة شخص واحد\nذات مسئولية محدودة\nالرياض - المملكة العربية السعودية\nبالريال السعودي\nقائمة التغير في حقوق الملكية\nعن الفترة المالية حتى ٣١ ديسمبر ٢٠٢٥م\nالرصيد في ٠١ / ٠١ / ٢٠٢٤م\nصافي ارباح الفترة\nالرصيد في ٣١ / ١٢ / ٢٠٢٤م\nالرصيد في ٠١ / ٠١ / ٢٠٢٥م\nتوزيع الأرباح\nصافي ارباح الفترة\nالرصيد في ٣١ / ١٢ / ٢٠٢٥م\n- ٧ -\nالمجموعة السعودية للمحاسبة والمراجعة - ص.ب ١٦٩٩٤ الرمز البريدي ١١٤٧٤ هاتف ٤٧٧٧٧٠٦ / ٢٠٦٢١٢٨ - فاكس : ٤٧٧٧٦٤٣ ٠١١\nP.O.Box 16994 Riyadh 11474 Tel.: 011 4777706 / 2062128 - Fax : 011 4777643\n\nشركة أصول إيلاف للتشغيل و الصيانة شركة شخص واحد\nذات مسئولية محدودة\nالرياض - المملكة العربية السعودية\nبالريال السعودي\nقائمة التدفق النقدي\nعن الفترة المالية حتى ٣١ ديسمبر ٢٠٢٥م\nالتدفقات النقدية من الانشطة التشغيلية\nصافي ربح الفترة\nالتعديلات\nإهلاك ممتلكات والات ومعدات\nمخصص مكافأة نهاية الخدمة\nالتغير في رأس المال العامل :\nالتغير في العملاء\nالتغير في الأرصدة المدينة الأخرى\nمصروفات مدفوعة مقدما\nالتغير في مخزون اخر المدة\nالتغير في الدائنون التجاريون\nالنقد الناتج من الانشطة التشغيلية\nالتدفق النقدي من أنشطة الاستثمار :\nإضافات ممتلكات والات ومعدات\nمشاريع تحت التنفيذ\nالنقد الناتج من الانشطة الاستثمارية\nالتدفق النقدي من أنشطة التمويل :\nالتغير في أطراف ذات علاقة - دائنة\nتوزيع أرباح\nالفائض النقدي من أنشطة التمويل\nالفائض النقدي خلال الفترة المالية\nرصيد النقد في اول المدة\nرصيد النقد في اخر المدة\n- ٨ -\nالمجموعة السعودية للمحاسبة والمراجعة - ص.ب ١٦٩٩٤ الرمز البريدي ١١٤٧٤ هاتف ٤٧٧٧٧٠٦ / ٢٠٦٢١٢٨ - فاكس : ٤٧٧٧٦٤٣ ٠١١\nP.O.Box 16994 Riyadh 11474 Tel.: 011 4777706 / 2062128 - Fax : 011 4777643",
  "pages": [
    {
      "page_number": 1,
      "text": "شركة أصول إيلاف للتشغيل و الصيانة شركة شخص واحد\nذات مسئولية محدودة\nالرياض - المملكة العربية السعودية\nبالريال السعودي\nقائمة المركز المالي حتى ٣١ / ١٢ / ٢٠٢٥م\nالاصول\nالاصول غير المتداولة\nممتلكات والات ومعدات ( بالصافي )\nمشاريع تحت التنفيذ\nمجموع الأصول غير المتداولة\nالاصول المتداولة :\nنقد لدى الصندوق و البنوك\nالعملاء\nمصروفات مدفوعة مقدما\nأرصدة مدينة أخرى\nمخزون\nمجموع الاصول المتداولة\nمجموع الاصول\nحقوق الملكية والخصوم :\nحقوق الملكية\nرأس المال\nإحتياطي نظامي\nارباح مبقاه\nمجموع حقوق الملكية\nالخصوم غير المتداولة :\nمخصص مكافأة نهاية الخدمة\nأطراف ذات علاقة - دائنة\nمجموع الخصوم غير المتداولة\nالخصوم المتداولة :\nالدائنون التجاريون\nأرصدة دائنة أخرى\nمخصص الزكاة الشرعية وضريبة الدخل\nمجموع الخصوم المتداولة\nمجموع الخصوم\nمجموع حقوق الملكية والخصوم\n- ٥ -\nالمجموعة السعودية للمحاسبة والمراجعة - ص.ب ١٦٩٩٤ الرمز البريدي ١١٤٧٤ هاتف ٤٧٧٧٧٠٦ / ٢٠٦٢١٢٨ - فاكس : ٤٧٧٧٦٤٣ ٠١١\nP.O.Box 16994 Riyadh 11474 Tel.: 011 4777706 / 2062128 - Fax : 011 4777643",
      "confidence": 0.98
    },
    {
      "page_number": 2,
      "text": "شركة أصول إيلاف للتشغيل و الصيانة شركة شخص واحد\nذات مسئولية محدودة\nالرياض - المملكة العربية السعودية\nبالريال السعودي\nقائمة الربح أو(الخسارة) و الدخل الشامل الاخر\nعن الفترة المالية حتى ٣١ ديسمبر ٢٠٢٥م\nالإيرادات\n(-) تكلفة الايرادات\nإجمالي ربح النشاط\n(-) مصاريف إدارية وعمومية\nصافي الربح قبل الزكاة\n(-) الزكاة الشرعية وضريبة الدخل\nصافي الربح الفترة بعد الزكاة وضريبة الدخل\nإجمالي الربح والدخل الشامل بالصافي\n- ٦ -\nالمجموعة السعودية للمحاسبة والمراجعة - ص.ب ١٦٩٩٤ الرمز البريدي ١١٤٧٤ هاتف ٤٧٧٧٧٠٦ / ٢٠٦٢١٢٨ - فاكس : ٤٧٧٧٦٤٣ ٠١١\nP.O.Box 16994 Riyadh 11474 Tel.: 011 4777706 / 2062128 - Fax : 011 4777643",
      "confidence": 0.98
    },
    {
      "page_number": 3,
      "text": "شركة أصول إيلاف للتشغيل و الصيانة شركة شخص واحد\nذات مسئولية محدودة\nالرياض - المملكة العربية السعودية\nبالريال السعودي\nقائمة التغير في حقوق الملكية\nعن الفترة المالية حتى ٣١ ديسمبر ٢٠٢٥م\nالرصيد في ٠١ / ٠١ / ٢٠٢٤م\nصافي ارباح الفترة\nالرصيد في ٣١ / ١٢ / ٢٠٢٤م\nالرصيد في ٠١ / ٠١ / ٢٠٢٥م\nتوزيع الأرباح\nصافي ارباح الفترة\nالرصيد في ٣١ / ١٢ / ٢٠٢٥م\n- ٧ -\nالمجموعة السعودية للمحاسبة والمراجعة - ص.ب ١٦٩٩٤ الرمز البريدي ١١٤٧٤ هاتف ٤٧٧٧٧٠٦ / ٢٠٦٢١٢٨ - فاكس : ٤٧٧٧٦٤٣ ٠١١\nP.O.Box 16994 Riyadh 11474 Tel.: 011 4777706 / 2062128 - Fax : 011 4777643",
      "confidence": 0.98
    },
    {
      "page_number": 4,
      "text": "شركة أصول إيلاف للتشغيل و الصيانة شركة شخص واحد\nذات مسئولية محدودة\nالرياض - المملكة العربية السعودية\nبالريال السعودي\nقائمة التدفق النقدي\nعن الفترة المالية حتى ٣١ ديسمبر ٢٠٢٥م\nالتدفقات النقدية من الانشطة التشغيلية\nصافي ربح الفترة\nالتعديلات\nإهلاك ممتلكات والات ومعدات\nمخصص مكافأة نهاية الخدمة\nالتغير في رأس المال العامل :\nالتغير في العملاء\nالتغير في الأرصدة المدينة الأخرى\nمصروفات مدفوعة مقدما\nالتغير في مخزون اخر المدة\nالتغير في الدائنون التجاريون\nالنقد الناتج من الانشطة التشغيلية\nالتدفق النقدي من أنشطة الاستثمار :\nإضافات ممتلكات والات ومعدات\nمشاريع تحت التنفيذ\nالنقد الناتج من الانشطة الاستثمارية\nالتدفق النقدي من أنشطة التمويل :\nالتغير في أطراف ذات علاقة - دائنة\nتوزيع أرباح\nالفائض النقدي من أنشطة التمويل\nالفائض النقدي خلال الفترة المالية\nرصيد النقد في اول المدة\nرصيد النقد في اخر المدة\n- ٨ -\nالمجموعة السعودية للمحاسبة والمراجعة - ص.ب ١٦٩٩٤ الرمز البريدي ١١٤٧٤ هاتف ٤٧٧٧٧٠٦ / ٢٠٦٢١٢٨ - فاكس : ٤٧٧٧٦٤٣ ٠١١\nP.O.Box 16994 Riyadh 11474 Tel.: 011 4777706 / 2062128 - Fax : 011 4777643",
      "confidence": 0.98
    }
  ],
  "tables": [
    {
      "page": 1,
      "table_id": "t1",
      "title": "قائمة المركز المالي حتى ٣١ / ١٢ / ٢٠٢٥م",
      "headers": [
        "البيان",
        "إيضاح",
        "٢٠٢٥م",
        "٢٠٢٤م"
      ],
      "rows": [
        [
          "الاصول",
          null,
          null,
          null
        ],
        [
          "الاصول غير المتداولة",
          null,
          null,
          null
        ],
        [
          "ممتلكات والات ومعدات ( بالصافي )",
          "(٣)",
          3900800,
          3189932
        ],
        [
          "مشاريع تحت التنفيذ",
          null,
          2656928,
          2188369
        ],
        [
          "مجموع الأصول غير المتداولة",
          null,
          6557728,
          5378301
        ],
        [
          "الاصول المتداولة :",
          null,
          null,
          null
        ],
        [
          "نقد لدى الصندوق و البنوك",
          "(٤)",
          515829,
          35416
        ],
        [
          "العملاء",
          null,
          14682130,
          11259674
        ],
        [
          "مصروفات مدفوعة مقدما",
          "(٥)",
          245980,
          231625
        ],
        [
          "أرصدة مدينة أخرى",
          "(٦)",
          null,
          180146
        ],
        [
          "مخزون",
          "(٧)",
          5335392,
          4347573
        ],
        [
          "مجموع الاصول المتداولة",
          null,
          20779331,
          16054434
        ],
        [
          "مجموع الاصول",
          null,
          27337059,
          21432735
        ],
        [
          "حقوق الملكية والخصوم :",
          null,
          null,
          null
        ],
        [
          "حقوق الملكية",
          null,
          null,
          null
        ],
        [
          "رأس المال",
          "(٨)",
          100000,
          100000
        ],
        [
          "إحتياطي نظامي",
          "(٩)",
          30000,
          30000
        ],
        [
          "ارباح مبقاه",
          null,
          8317808,
          10171400
        ],
        [
          "مجموع حقوق الملكية",
          null,
          8447808,
          10301400
        ],
        [
          "الخصوم غير المتداولة :",
          null,
          null,
          null
        ],
        [
          "مخصص مكافأة نهاية الخدمة",
          "(١٠)",
          182061,
          121374
        ],
        [
          "أطراف ذات علاقة - دائنة",
          "(١١)",
          13975009,
          7515430
        ],
        [
          "مجموع الخصوم غير المتداولة",
          null,
          14157070,
          7636804
        ],
        [
          "الخصوم المتداولة :",
          null,
          null,
          null
        ],
        [
          "الدائنون التجاريون",
          "(١٢)",
          3429670,
          2120397
        ],
        [
          "أرصدة دائنة أخرى",
          "(١٣)",
          236908,
          null
        ],
        [
          "مخصص الزكاة الشرعية وضريبة الدخل",
          "(١٤)",
          1065603,
          1374133
        ],
        [
          "مجموع الخصوم المتداولة",
          null,
          4732181,
          3494530
        ],
        [
          "مجموع الخصوم",
          null,
          18889251,
          11131334
        ],
        [
          "مجموع حقوق الملكية والخصوم",
          null,